kampo_number,name,name_kana,symptoms,patterns,crude_drugs,classification,indications,Physical,point
120,黄連湯,おうれんとう,胃痛|嘔吐|食欲不振|急性胃炎|口内炎|二日酔い,実証|中間証|熱証|寒証|急虚,ハンゲ|オウレン|カンキョウ|カンゾウ|ケイヒ|タイソウ|ニンジン,消化器|鼻腔咽喉|歯・口腔,口内炎|急性胃炎|二日酔い,体力中等度以上,上腹部痛、悪心、嘔吐があり心窩部に抵抗の認められる場合
121,三物黄芩湯,さんもつおうごんとう,ほてり,実証|熱証|中間証|陰虚,オウゴン|ジオウ|クジン,共通（領域を問わないもの）,手足のほてり,体力中等度あるいはそれ以上,手足に熱感があり、口渇や搔痒感、発熱を伴う場合
122,排膿散及湯,はいのうさんきゅうとう,化膿|腫れ|瘍|おでき|ニキビ|面疔,中間証|熱証,キキョウ|カンゾウ|キジュツ|シャクヤク|タイソウ|ショウキョウ,皮膚|歯・口腔,皮膚炎|せつ（癤）|よう（瘍）|面疔|癤腫症|発疹、疼痛を伴う化膿症,体力中等度前後,化膿性皮膚疾患、歯周組織炎（歯槽膿漏）、歯齦炎などに伴う場合
123,当帰建中湯,とうきけんちゅうとう,腹痛|痔|脱肛|月経痛,虚証|寒証|気虚|血虚,トウキ|シャクヤク|ケイヒ|タイソウ|トウキ|カンゾウ,消化器|小児|外科・周術期|産婦人科|泌尿器,下腹部痛|痔|脱肛の痛み|月経痛,体力低下,疲労しやすく、顔色不良、手足が冷え、腰に痛みがある場合
124,川芎茶調散,せんきゅうちゃちょうさん,頭痛|感冒|血の道症,実証|中間証|虚証|熱証|寒証|瘀血,センキュウ|ハッカ|コウブシ|キョウカツ|ケイガイ|ビャクシ|ボウフウ|カンゾウ|チャヨウ,呼吸器|神経・筋・脳神経|小児|産婦人科,感冒|頭痛|血の道症,体力は問わない,感冒の初期の頭痛、特発性頭痛がある場合
125,桂枝茯苓丸加薏苡仁,けいしぶくりょうがんかよくいにん,血の道症|ニキビ|しみ|手足の荒れ|月経不順|下腹部痛|肩こり|頭重|めまい|のぼせ|冷え性,実証|中間証|熱証|寒証|気滞|瘀血|水滞,ケイヒ|ブクリョウ|ヨクイニン|シャクヤク|トウニン|ボタンピ,産婦人科|皮膚,血の道症|月経不順|面皰|水虫|手足の荒れ,体力中等度もしくはそれ以上,のぼせて、下腹部に抵抗・圧痛などの瘀血の症状、皮膚症状がある場合
126,麻子仁丸,ましにんがん,便秘,虚証|中間証|陰虚,マシニン|キョウニン|ダイオウ|キジツ|キョウニン|コウボク|シャクヤク,消化器|外科・周術期,便秘,体力中等度あるいは低下,老人や病後の虚弱者で大便は硬く塊状を呈する場合
127,麻黄附子細辛湯,まおうぶしさいしんとう,悪寒|倦怠感|微熱|低血圧|頭痛|めまい|冷え性|感冒|気管支炎,虚証|寒証|中間証,マオウ|ブシ|サイシン,呼吸器|小児,感冒|気管支炎,比較的体力低下,虚弱者で悪寒を伴う発熱（微熱）や手足の冷えのどの痛みがある場合
128,啓脾湯,けいひとう,下痢|食欲不振|消化不良|慢性胃腸炎|胃腸虚弱,虚証|気虚|水滞,ニンジン|ソウジュツ|ブクリョウ|サンヤク|レンニク|サンザシ|タクシャ|チンピ|カンゾウ,消化器|小児|外科・周術期,胃腸虚弱|慢性胃腸炎|下痢|消化不良,比較的体力低下,顔色不良で、裏急後重（しぶり腹）を伴わない下痢の場合
133,大承気湯,だいじょうきとう,便秘|腹満|高血圧|神経症|食当り,実証|熱証|気滞|瘀血|水滞,ダイオウ|ボウショウ|キジツ|コウボク,循環器|消化器|小児|外科・周術期|精神・神経,高血圧|食あたり|急性便秘|常習便秘|神経症,体力充実,腹部、特に臍を中心に充実して膨満感が強く便秘する場合
134,桂枝加芍薬大黄湯,けいしかしゃくやくだいおうとう,腹痛|便秘|大腸カタル|急性腸炎|宿便|しぶり腹,中間証|虚証|寒証,ケイヒ|シャクヤク|ダイオウ|タイソウ|カンゾウ|ショウキョウ,消化器,口内炎|急性腸炎|大腸炎|常習便秘|宿便|しぶり腹,比較的体力のある,上腹部より胸部への不快感を訴え、悪心、便秘、皮膚搔痒感を伴う場合
135,茵蔯蒿湯,いんちんこうとう,黄疸|肝硬変|ネフローゼ|蕁麻疹|口内炎,実証|熱証|水滞,インチンコウ|ダイオウ|サンシシ,消化器|腎|小児|外科・周術期|皮膚|鼻腔咽喉|歯・口腔,黄疸|肝硬変|ネフローゼ|蕁麻疹|口内炎,比較的体力ある,上腹部より腹部へ不快感を訴え、悪心、嘔吐、便秘、皮膚搔痒感を伴う場合
136,清暑益気湯,せいしょえっきとう,倦怠感|食欲不振|下痢|夏やせ,虚証|熱証|気虚|血虚|陰虚,ニンジン|オウギ|ソウジュツ|ニンジン|バクモントウ|チンピ|トウキ|オウバク|ゴミシ,共通（領域を問わないもの）|消化器|小児|外科・周術期,食欲不振|疲労倦怠|夏やせ|暑気あたり|下痢|神経症,比較的体力低下,全身倦怠感、軟便、手足のの熱感、夏やせ、夏負け等に。
137,加味帰脾湯,かみきひとう,不眠|不安|神経症|貧血,虚証|気虚|気滞|血虚,オウギ|サイコ|サンソウニン|ソウジュツ|ニンジン|ブクリョウ|リュウガンニク|オンジ|サンシシ|タイソウ|トウキ|カンゾウ|ショウキョウ|モッコウ,血液|産婦人科|精神・神経,貧血|神経症|神経不安|不眠,体力低下,顔色が悪く精神不安などの精神症状、微熱がある場合
138,桔梗湯,キキョウトウ,扁桃炎|扁桃周囲炎,実証|中間証|虚証|熱証|寒証,カンゾウ|キキョウ,鼻腔咽喉,扁桃炎,体力は問わない,咽喉、扁桃の炎症で疼痛、腫脹がある場合
,,,,,,,,,
