kampo_number,name,name_kana,symptoms,patterns,crude_drugs,classification,indications,Physical,point
57,温清飲,うんせいいん,のぼせ|月経不順|月経困難|血の道症|更年期障害|神経症,中間証|熱証|血虚,センキュウ|トウキ|シャクヤク|ジオウ|オウゴン|オウバク|オウレン|サンシシ,小児|産婦人科|精神・神経,神経症|更年期障害|血の道症|月経不順|月経困難,体力中等度,不安、不眠、のぼせなどの精神神経症状があり、出血傾向を伴う場合
58,清上防風湯,せいじょうぼうふうとう,にきび,実証|熱証,オウゴン|キキョウ|サンシシ|センキュウ|ハマボウフウ|ビャクシ|レンギョウ|オウレン|カンゾウ|キジツ|ケイガイ|ハッカ,皮膚,面皰,比較的体力のある,青年の面皰、顔面、頭部の発疹が強く、化膿している場合
59,治頭瘡一方,ぢづそういっぽう,湿疹|くさ|,実証|中間証|熱証|血滞,センキュウ|ソウジュツ|レンギョウ|ニンドウ|ボウフウ|カンゾウ|ケイガイ|コウカ|ダイオウ,小児|皮膚,湿疹|乳幼児の湿疹|くさ,比較的体力ある,顔面、頭部などの湿疹で、分泌液、びらん、搔痒感のある場合
60,桂枝加芍薬湯,けいしかしゃくやくとう,腹痛|しぶり腹,虚証|寒証|気滞|血虚,ケイヒ|シャクヤク|カンゾウ|タイソウ|ショウキョウ,消化器|小児,腹痛|しぶり腹,比較的体力低下,桂枝加芍薬大黄湯より裏急後重（しぶり腹）、便秘が軽度の場合
61,桃核承気湯,とうかくじょうきとう,便秘|月経不順|月経困難|不安|腹痛|便秘|高血圧,実証|熱証|気滞|瘀血,トウニン|ダイオウ|ケイヒ|カンゾウ|ボウショウ,循環器|消化器|神経・筋・脳神経|外科・周術期|整形・運動器|産婦人科,高血圧の随伴症状（頭痛、めまい、肩こり）|便秘|腰痛|月経時や産後の精神不安|月経不順|月経困難,体力充実,瘀血、左下腹部に抵抗・圧痛（小腹急結）、便秘、のぼせのある場合
62,防風通聖散,ぼうふうつうしょうさん,肥満|便秘|浮腫|高血圧,実証|熱証|瘀血|血虚|水滞,カッセキ|オウゴン|カンゾウ|キキョウ|セッコウ|ビャクジュツ|ダイオウ|ケイガイ|サンシシ|シャクヤク|センキュウ|トウキ|ハッカ|ボウフウ|マオウ|レンギョウ|ボウショウ|ショウキョウ,共通（領域を問わないもの）|循環器|消化器|腎|代謝・内分泌|神経・筋・脳神経|小児|外科・周術期,むくみ|高血圧の随伴症状（動悸、肩こり、のぼせ）|便秘|肥満症,体力充実,便秘し腹は臍を中心に膨満して力のある、いわゆる太鼓腹の場合
63,五積散,ごしゃくさん,冷え症|腹痛|胃腸炎|神経痛|関節痛|月経痛|頭痛|更年期障害|感冒,中間証|寒証|気滞|瘀血|血虚|水滞,ソウジュツ|チンピ|トウキ|ハンゲ|ブクリョウ|カンゾウ|キキョウ|キジツ|ケイヒ|コウボク|シャクヤク|ショウキョウ|センキュウ|タイソウ|ビャクシ|マオウ,呼吸器|神経・筋・脳神経|小児|整形・運動器|産婦人科,感冒|胃腸炎|頭痛|神経痛|腰痛|関節痛|更年期障害|冷え性|月経痛,体力中等度前後,悪寒や湿気により腹痛、下腹部痛、下肢の痛みなどを訴える場合
64,炙甘草湯,しゃかんぞうとう,動機|息切れ,虚証|熱証|寒証|気虚|陰虚,ジオウ|バクモントウ|ケイヒ|シャカンゾウ|タイソウ|ニンジン|マシニン|ショウキョウ|アキョウ,循環器,動悸|息切れ,比較的体力低下,息切れ、皮膚の枯燥、易疲労感、手足の煩熱などを伴う場合
65,帰脾湯,きひとう,不眠|貧血,虚証|寒証|気虚|血虚,オウギ|サンソウニン|ニンジン|ビャクジュツ|ブクリョウ|リュウガンニク|オンジ|タイソウ|トウキ|カンゾウ|ショウキョウ|モッコウ,血液|産婦人科|精神・神経,貧血|不眠,比較的体力低下,顔色が悪く、精神不安、動悸亢進。不眠等がある場合
66,参蘇飲,じんそいん,咳|感冒,虚証|熱証|寒証|気滞|気虚|水滞,ハンゲ|ブクリョウ|カッコン|キキョウ|ゼンコ|チンピ|タイソウ|ニンジン|カンゾウ|キジュツ|ソヨウ|ショウキョウ,呼吸器|小児,感冒|咳,体力中等度前後,胃腸の弱い人で数日を経て長引いた場合
67,女神散,にょしんさん,のぼせ|めまい|神経症|月経不順|血の道症,中間証|気滞|瘀血,コウブシ|センキュウ|ソウジュツ|トウキ|オウゴン|ケイヒ|ニンジン|ビンロウジ|オウレン|カンゾウ|チョウジ|モッコウ,産婦人科,血の道症|産前産後の神経症|月経不順,体力中等度,のぼせ、めまい、頭痛、不安、不眠等の精神神経症状等がある場合
68,芍薬甘草湯,しゃくやくかんぞうとう,筋肉痛|けいれん|関節痛|胃痛|腹痛,実証|中間証|虚証|血虚,シャクヤク|カンゾウ,消化器|神経・筋・脳神経|小児|整形・運動器,胃痛|腹痛|関節痛|筋肉痛|急激に起こる筋肉のけいれんを伴う疼痛,体力は問わない,急激に起こる筋肉のけいれん性疼痛、腹部疝痛に
69,茯苓飲,ブクリョウイン,胃炎|胃アトニー|溜飲,中間証|虚証|熱証|寒証|気虚|水滞|気滞,ブクリョウ|ソウジュツ|チンピ|ニンジン|キジュツ|ショウキョウ,消化器,胃アトニー|胃炎|溜飲,体力中等度あるいはやや低下,膨満感、胸焼け、悪心などのある場合
70,香蘇散,こうそさん,胃もたれ|感冒,虚証|熱証|寒証|気滞,コウブシ|ソヨウ|チンピ|カンゾウ|ショウキョウ,呼吸器|小児,感冒|感冒（初期）,比較的体力低下,胃腸虚弱で、抑うつ傾向のある場合
71,四物湯,しもつとう,冷え症|しもやけ|しみ|血の道症|月経不順|疲労回復,虚証|熱証|寒証|瘀血|血虚,トウキ|シャクヤク|センキュウ|ジオウ,産婦人科|皮膚,産後あるいは流産後の疲労回復|血の道症|冷え性|月経不順|しもやけ|水虫,比較的体力低下,手足が冷え、貧血、出血傾向、皮膚の枯燥傾向のある場合
72,甘麦大棗湯,かんばくたいそうとう,夜泣き|ひきつけ,虚証|熱証|寒証|気滞,カンゾウ|ショウバク|タイソウ,小児,小児夜啼症|ひきつけ,比較的体力低下,精神興奮がはなはだしく、不安、不眠、ひきつけ、腹硬直の攣急を伴う場合
73,柴陥湯,さいかんとう,咳|胸痛,中間証|熱証|寒証|気虚水滞,サイコ|ハンゲ|オウゴン|タイソウ|ニンジン|オウレン|カンゾウ|ショウキョウ|カロニン,呼吸器|小児,咳|咳による胸痛,体力中等度,胸脇苦満があり痰が切れにくい場合で強い咳が出て胸痛する場合
74,調胃承気湯,ちょういじょうきとう,べんぴ,中間証|熱証|寒証,ダイオウ|カンゾウ|ボウショウ,消化器|外科・周術期,便秘,体力中等度,腹部膨満感が強く腹痛する場合
75,四君子湯,しくんしとう,胃腸虚弱|慢性胃炎|胃もたれ|嘔吐|下痢,虚証|熱証|寒証|気虚,ニンジン|ソウジュツ|ブクリョウ|カンゾウ|ショウキョウ|タイソウ,消化器|小児|外科・周術期,胃腸虚弱|慢性胃炎|胃もたれ|嘔吐|下痢,体力低下,胃腸機能が低下して食欲不振心窩部膨満感を訴える場合
76,竜胆瀉肝湯,りゅうたんしゃかんとう,排尿痛|残尿感|尿の濁り|こしけ,実証|熱証|血虚|水滞,ジオウ|トウキ|モクツウ|オウゴン|シャゼンシ|タクシャ|カンゾウ|サンシシ|リュウタン,産婦人科|泌尿器,こしけ|残尿感|排尿痛|尿の濁り,比較的体力ある,泌尿器、生殖器等の炎症に伴い排尿痛、頻尿、帯下等のある場合
77,芎帰膠艾湯,きゅうききょうがいとう,痔出血,虚証|熱証|寒証|血虚,ジオウ|シャクヤク|トウキ|ガイヨウ|カンゾウ|センキュウ|アキョウ,消化器|外科・周術期|産婦人科,痔出血,比較的体力低下,出血が長引き、貧血、冷え性等を伴う場合
78,麻杏薏甘湯,まきょうよくかんとう,関節痛|神経痛|筋肉痛,実証|中間証|寒証|水滞,ヨクイニン|マオウ|キョウニン|カンゾウ,神経・筋・脳神経|整形・運動器,神経痛|関節痛|筋肉痛,比較的体力のある,関節や筋肉が腫れるが、腫脹が軽度で、痛みも緩和な場合
79,平胃散,へいいさん,急性胃カタル|慢性胃カタル|胃アトニー|消化不良|食欲不振,中間証|熱証|寒証|気滞|水滞,ソウジュツ|コウボク|チンピ|タイソウ|カンゾウ|ショウキョウ,共通（領域を問わないもの）|消化器|小児|外科・周術期,食欲不振|胃アトニー|急性胃炎|慢性胃炎|消化不良,体力中等度前後,消化障害により腹部膨満感、心窩部不快感、下痢等がある場合
80,柴胡清肝湯,さいこせいかんとう,神経症|慢性扁桃炎|湿疹,実証|熱証|気滞|血虚,サイコ|オウゴン|オウバク|オウレン|カロコン|カンゾウ|キキョウ|ゴボウシ|サンシシ|ジオウ|シャクヤク|センキュウ|トウキ|ハッカ|レンギョウ,小児|皮膚|鼻腔咽喉|精神・神経,神経症|慢性扁桃炎|湿疹,比較的体力低下,腺病質の小児で、皮膚の色が浅黒く、扁桃、頸部等に炎症起こしやすい場合
81,二陳湯,にちんとう,悪心|嘔吐,中間証|熱証|寒証|水滞,ハンゲ|チンピ|ブクリョウ|カンゾウ|ショウキョウ,消化器|小児,悪心|嘔吐,体力中等度前後,嘔吐、胃部不快感、時に心窩部に振水音を認める場合
82,桂枝人参湯,けいしにんじんとう,頭痛|動悸|慢性胃腸炎|胃アトニー,虚証|寒証|気虚,ケイヒ|ニンジン|カンゾウ|ソウジュツ|カンキョウ,循環器|消化器|神経・筋・脳神経,動悸|胃アトニー|慢性胃腸炎|頭痛,比較的体力低下,冷え性で疲れやすく、胃腸症状、頭痛、心悸亢進等を伴う場合
83,抑肝散加陳皮半夏,よくかんさんかちんぴはんげ,神経症|不眠症|小児夜泣き|小児疳症,虚証|中間証|気滞|水滞,チンピ|ハンゲ|ソウジュツ|ブクリョウ|センキュウ|チョウトウコウ|トウキ|サイコ|カンゾウ,小児|精神・神経,小児夜啼症|小児疳症|神経症|不眠,比較的体力低下,抑肝散に比べ、より体力が低下して症状がより慢性化していることが多い場合
84,大黄甘草湯,だいおうかんぞうとう,便秘,実証|中間証|虚証,ダイオウ|カンゾウ,消化器|外科・周術期,便秘,体力は問わない,常習便秘に広く用いる
85,神秘湯,しんぴとう,小児喘息|気管支喘息|気管支炎,実証|中間証|熱証|寒証|気滞,マオウ|キョウニン|コウボク|チンピ|カンゾウ|サイコ|ソヨウ,呼吸器|小児,気管支炎|気管支喘息|小児喘息,体力中等度度あるいはそれ以上,呼吸困難、を主訴として抑うつ傾向を呈する場合
86,当帰飲子,とうきいんし,かゆみ|湿疹,虚証|血虚,トウキ|ジオウ|シツリシ|シャクヤク|センキュウ|ボウフウ|カシュウ|オウギ|カイガイ|カンゾウ,小児|皮膚,慢性湿疹（分泌液の少ないもの）|痒み,比較的体力低下,皮膚が乾燥していて、搔痒を主訴として、分泌物の少ない場合
87,六味丸,ろくみがん,頻尿|排尿困難|頻尿|むくみ|かゆみ,虚証|陰虚,ジオウ|サンシュユ|サンヤク|タクシャ|ブクリョウ|ボタンピ,共通（領域を問わないもの）|腎|神経・筋・脳神経|小児|外科・周術期|皮膚|泌尿器,むくみ|痒み|排尿困難|頻尿,比較的体力低下,腰以下の脱力感、痺れ、排尿時違和感等を伴う場合
88,二朮湯,にじゅつとう,五十肩,中間証|寒証|気滞|水滞,ハンゲ|ソウジュツ|イレイセン|オウゴン|コウブシ|チンピ|ビャクジュツ|ブクリョウ|カンゾウ|ショウキョウ|テンナンショウ|ワキョウカツ,神経・筋・脳神経|整形・運動器,五十肩,体力中等度,肩や上腕の痛む場合
89,治打撲一方,ぢだぼくいっぽう,打撲|腫れ|痛み,実証|中間証|虚証|熱証|瘀血,ケイヒ|センキュウ|センコツ|ボクソク|カンゾウ|ダイオウ|チョウジ,外科・周術期,打撲による腫れ及び痛み,体力は問わない,打撲、捻挫による患部の腫脹、疼痛に用いる
90,清肺湯,せいはいとう,咳|痰,中間証|虚証|熱証|水滞|陰虚,トウキ|バクモントウ|ブクリョウ|オウゴン|キキョウ|キョウニン|サンシシ|ソウハクヒ|タイソウ|チンピ|テンモンドウ|バイモ|カンゾウ|ゴミシ|ショウキョウ|チクジョ,呼吸器|小児,痰の多く出る咳,比較的体力低下,粘稠性で切れにくい痰が多い蔓延化した場合
91,竹筎温胆湯,ちくじょうんたんとう,インフルエンザ|感冒|肺炎|咳|痰,中間証|虚証|熱証|水滞|気虚|陰虚,ハンゲ|サイコ|バクモントウ|ブクリョウ|キキョウ|キジツ|コウブシ|チンピ|オウレン|カンゾウ|ショウキョウ|ニンジン|チクジョ,呼吸器|小児,感冒|インフルエンザ|咳|痰|肺炎,比較的体力低下,回復期に熱が長引き咳、痰が多く不眠時に胸脇苦満のある場合
92,滋陰至宝湯,じいんしほうとう,咳|痰,虚証|熱証|気滞|陰虚,コウブシ|サイコ|ジコッピ|シャクヤク|チモ|チンピ|トウキ|バクモントウ|ビャクジュツ|ブクリョウ|バイモ|カンゾウ|ハッカ,呼吸器|小児,咳|痰,体力低下,全身倦怠感、盗汗を伴う、慢性に経過した咳嗽に用いる
93,滋陰降火湯,じいんこうかとう,痰|咳,虚証|熱証|血虚|陰虚,ソウジュツ|ジオウ|シャクヤク|チンピ|テンモンドウ|トウキ|バクモントウ|オウバク|カンゾウ|チモ,呼吸器|小児,痰の出ない,体力低下,皮膚の色が浅黒く、咳嗽、粘稠で切れにくい痰などがある場合
95,五虎湯,ごことう,咳|気管支喘息,実証|熱証|水滞,マオウ|セッコウ|キョウニン|ソウハクヒ|カンゾウ,呼吸器|小児,咳|気管支喘息,比較的体力のある,心窩部膨満し胸脇苦満、咳嗽、喀痰、水様性鼻汁などを伴う場合
96,柴朴湯,さいぼくとう,動悸|めまい|嘔吐|小児喘息|気管支喘息|気管支炎|咳|神経症,中間証|熱証|気虚|気滞|水滞,サイコ|ハンゲ|ブクリョウ|オウゴン|コウボク|タイソウ|ニンジン|カンゾウ|ソヨウ|ショウキョウ,呼吸器|膠原病|小児|精神・神経,気管支炎|咳|関節リウマチ（下肢）|気管支喘息|小児喘息|咳|不安神経症,体力中等度,心窩部膨満、咳嗽、喘息、精神不安、抑うつ等がある場合
97,大防風湯,だいぼうふうとう,関節リウマチ|慢性関節炎|痛風,虚証|寒証|気虚|瘀血|血虚|水滞,オウギ|ジオウ|シャクヤク|ソウジュツ|トウキ|トチュウ|ボウフウ|センキュウ|カンゾウ|キョウカツ|ゴシツ|タイソウ|ニンジン|カンキョウ|ブシ,代謝・内分泌|整形・運動器,痛風|関節リウマチ（下肢）|慢性関節炎,比較的体力低下,顔色不良、関節の腫脹・疼痛、運動機能障害等が慢性化した場合
98,黄耆建中湯,おうぎけんちゅうとう,虚弱|衰弱|寝汗,虚証|寒証|気虚|血虚,オウギ|シャクヤク|ケイヒ|カンゾウ|ショウキョウ|タイソウ,共通（領域を問わないもの）|小児|外科・周術期,虚弱体質|病後の体力低下|ねあせ|病後の体力低下,体力低下,疲労倦怠感が著しく盗汗があり時に腹直筋の緊張する場合
99,小建中湯,しょうけんちゅうとう,腹痛|動悸|ほてり|冷え性|頻尿|多尿|虚弱体質|疲労倦怠|神経質|慢性胃腸炎|小児夜尿症|夜泣き,虚証|寒証|気虚|血虚,シャクヤク|ケイヒ|タイソウ|カンゾウ|ショウキョウ,共通（領域を問わないもの）|消化器|小児|精神・神経,疲労倦怠|慢性胃腸炎|小児虚弱体質|小児夜尿症|小児夜啼症|神経質,体力低下,疲れやすく腹部は腹壁の筋肉が薄く腹直筋の緊張する場合
100,大建中湯,だいけんちゅうとう,腹痛|腹部膨満感,虚証|寒証|気虚,カンキョウ|サンショウ|ニンジン,消化器|小児|外科・周術期|泌尿器,腹痛|腹部膨満感,体力低下,四肢が冷えて、腹部が冷え、腹部膨満感、鼓腸のある場合
101,升麻葛根湯,しょうまかっこんとう,感冒|皮膚炎,中間証|熱証|寒証,カッコン|シャクヤク|ショウマ|カンゾウ|ショウキョウ,呼吸器|小児|皮膚,感冒（初期）|皮膚炎,体力中等度,頭痛、発熱、悪寒、発疹などを伴う場合
102,当帰湯,トウキトウ,腹痛|腹部膨満感|背中の冷え,虚証|寒証|気虚|気滞|血虚|水滞,トウキ|ハンゲ|ケイヒ|コウボク|シャクヤク|ニンジン|オウギ|カンキョウ|サンショウ|カンゾウ,消化器|小児|外科・周術期|泌尿器,腹痛|腹部膨満感,比較的体力低下,冷え性で血色の悪い人で胸腹部より背部に疼痛を訴える場合
103,酸棗仁湯,サンソウニントウ,不眠症|神経症,虚証,サンソウニン|ブクリョウ|センキュウ|チモ,精神・神経,不眠,体力低下,心身とも疲労して、精神不安、神経過敏等を伴う場合
104,辛夷清肺湯,しんいせいはいとう,鼻づまり|慢性鼻炎|蓄膿症,実証|熱証|中間証|水滞|陰虚,セッコウ|バクモントウ|オウゴン|サンシシ|チモ|ビャクゴウ|シンイ|ビワヨウ|ショウマ,鼻腔咽喉,慢性鼻炎|蓄膿症|鼻づまり,体力中等度あるいはそれ以上,膿性鼻炎、後鼻漏などを伴う鼻疾患に用いる
105,通導散,つうどうさん,月経不順|更年期障害|便秘|腹痛|打撲|高血圧|頭痛|めまい|肩こり,実証|熱証|気滞|瘀血|水滞,キジツ|ダイオウ|トウキ|カンゾウ|コウカ|コウボク|ソボク|チンピ|モクツウ|ボウショウ,循環器|消化器|神経・筋・脳神経|外科・周術期|整形・運動器|産婦人科,高血圧の随伴症状（頭痛、めまい、肩こり）|便秘|腰痛|打撲|更年期障害|月経不順|月経痛,体力充実,心窩部・下腹部の圧痛・瘀血があり便秘精神神経症状を伴う場合
106,温経湯,うんけいとう,ほてり|月経不順|月経困難|こしけ|更年期障害|不眠症|神経症|湿疹|冷え性|しもやけ,虚証|寒証|中間証|寒証|気虚|瘀血|血虚,バクモントウ|ハンゲ|トウキ|カンゾウ|ケイヒ|シャクヤク|センキュウ|ニンジン|ボタンピ|ゴシュユ|ショウキョウ,共通（領域を問わないもの）|小児|産婦人科|皮膚|精神・神経,足腰の冷え|神経症|湿疹|更年期障害|月経不順|月経困難|こしけ|しもやけ|不眠,体力低下,手掌がほてり、口唇が乾燥し、下腹部が冷えて痛む場合
107,牛車腎気丸,ごしゃじんきがん,下肢痛|腰痛|痺れ|かすみ目|痒み|排尿困難|頻尿|浮腫,虚証|中間証|寒証|気虚|瘀血|水滞,ジオウ|ブシ|ゴシツ|サンシュユ|サンヤク|シャゼンシ|タクシャ|ブクリョウ|ボタンピ|ケイヒ,共通（領域を問わないもの）|循環器|腎|代謝・内分泌|神経・筋・脳神経|小児|外科・周術期|整形・運動器|産婦人科|皮膚|泌尿器|眼,むくみ|痺れ|腰痛|下肢痛|痒み|排尿困難|頻尿|老人のかすみ目,比較的体力低下,中年以降、腰部下肢の脱力感、冷え、痺れ、排尿異常がある場合
108,人参養栄湯,にんじんようえいとう,疲労|貧血|体力低下|食欲不振|寝汗|冷え性,虚証|寒証|気虚|血虚,ニンジン|トウキ|シャクヤク|ジオウ|ビャクジュツ|ブクリョウ|ケイヒ|オンジ|チンピ|オウギ|カンゾウ|ゴミシ,共通（領域を問わないもの）|消化器|血液|小児|外科・周術期|産婦人科,病後の体力低下|食欲不振|疲労倦怠|ねあせ|手足の冷え|食欲不振|貧血|病後の体力低下,体力低下,十全大補湯に近似するが、咳嗽、不眠などを伴う場合
109,小柴胡湯加桔梗石膏,しょうさいことうかききょうせっこう,扁桃炎|扁桃周囲炎,中間証|熱証|気虚,セッコウ|サイコ|ハンゲ|オウゴン|キキョウ|タイソウ|ニンジン|カンゾウ|ショウキョウ,鼻腔咽喉,扁桃炎|扁桃周囲炎,体力中等,亜急性ないし慢性化し、微熱、胸脇苦満、食欲不振を訴える場合
110,立効散,りっこうさん,疼痛|歯痛,実証|中間証|虚証|熱証|寒証,サイシン|ショウマ|ボウフウ|カンゾウ|リュウタン,歯・口腔,抜歯後の疼痛|歯痛,体力は問わない,歯痛後、歯齦痛および口腔内の腫脹・疼痛に用いる
111,清心蓮子飲,せいしんれんしいん,頻尿|排尿痛|残尿感,虚証|熱証|寒証|気虚|水滞,バクモントウ|ニンジン|ブクリョウ|レンコク|オウゴン|シャゼンシ|オウギ|ジコッピ|カンゾウ,泌尿器,残尿感|排尿痛|頻尿,比較的体力低下,胃腸の虚弱な人が、排尿困難、排尿痛等を訴える場合
112,猪苓湯合四物湯,ちょれいとうごうしもつとう,排尿痛|頻尿|排尿困難|残尿感,虚証|熱証|中間証|血虚|水滞,カッセキ|ジオウ|センキュウ|チョレイ|タクシャ|トウキ|シャクヤク|ブクリョウ|アキョウ,泌尿器,排尿困難|残尿感|排尿痛|頻尿,体力中等度,皮膚が枯燥し、頻尿、排尿痛等の排尿困難が慢性化・反復する場合
113,三黄瀉心湯,さんおうしゃしんとう,のぼせ|便秘|不安症|高血圧|のぼせ|肩こり|耳鳴り|頭重|不眠症|鼻血|痔出血|更年期障害|血の道症,実証|熱証,オウゴン|オウレン|ダイオウ,循環器|消化器|外科・周術期|産婦人科|鼻腔咽喉,高血圧の随伴症状（のぼせ、肩こり、耳鳴り、頭重、不眠、不安）|便秘|痔出血|更年期障害|血の道症|鼻血,体力充実,のぼせ気味で顔面紅潮し便秘、精神不安などを伴う場合
114,柴苓湯,さいれいとう,下痢|暑気あたり|急性胃腸炎|水瀉性下痢|吐き気|食欲不振,中間証|水滞|熱証|気虚,サイコ|タクシャ|ブクリョウ|ハンゲ|オウゴン|ソウジュツ|タイソウ|チョレイ|ニンジン|カンゾウ|ケイヒ|ショウキョウ,共通（領域を問わないもの）|消化器|腎|神経・筋・脳神経|小児|外科・周術期,暑気あたり|むくみ|急性胃腸炎|水瀉性下痢,体力中等度,胸脇苦満があり、尿量減少、浮腫、口渇などを伴う場合
115,胃苓湯,いれいとう,下痢|食欲不振|嘔吐|冷え腹|急性胃腸炎|腹痛,中間証|水滞|気滞|熱証|寒証,コウボク|ソウジュツ|チョレイ|チンピ|ビャクジュツ|ブクリョウ|タクシャ|ケイヒ|ショウキョウ|タイソウ|カンゾウ,共通（領域を問わないもの）|消化器|小児,暑気あたり|急性胃腸炎|食あたり|冷え腹|腹痛,体力中等度,心窩部に振水音を認め、水溶性の下痢、嘔吐、口渇を呈する場合
116,茯苓飲合半夏厚朴湯,ぶくりょういんごうはんげこうぼくとう,胃もたれ|不安症|動悸|めまい|嘔気|胸焼け|胃炎|つわり|溜飲|,虚証|中間証|熱証|寒証|気滞|水滞,ブクリョウ|ハンゲ|コウボク|ソウジュツ|チンピ|ニンジン|ソヨウ|キジツ|ショウキョウ,消化器|産婦人科|精神・神経,胃炎|神経性胃炎|溜飲|つわり|不安神経症,体力中等度あるいはやや低下,抑うつ状態、咽喉部の異物感、胃部膨満感、悪心などを訴える場合
117,茵蔯五苓散,いんちんごれいさん,浮腫|嘔吐|蕁麻疹|二日酔い,中間証|水滞|熱証|寒証,インチンコウ|タクシャ|ブクリョウ,共通（領域を問わないもの）|消化器|腎|神経・筋・脳神経|小児|外科・周術期|皮膚,むくみ|嘔吐|二日酔いのむかつき|蕁麻疹,体力中等度,口渇、尿量減少があり、軽度の黄疸を伴う場合
118,苓姜朮甘湯,りょうきょうじゅつかんとう,冷え|腰痛|夜尿症,虚証|寒証|気虚|水滞,ブクリョウ|カンキョウ|ビャクジュツ|カンゾウ,共通（領域を問わないもの）|神経・筋・脳神経|小児|整形・運動器|産婦人科,腰の冷え|腰痛|夜尿症,比較的体力低下,腰部より下肢にかけての冷えが顕著で頻尿を訴える場合
119,苓甘姜味辛夏仁湯,りょうかんきょうみしんげにんとう,貧血|冷え性|痰|咳|気管支喘息|気管支炎|心臓衰弱|腎臓病,虚証|寒証|中間証|水滞,カンキョウ|サイシン|ハンゲ|キョウニン|ゴミシ|カンゾウ|ブクリョウ,呼吸器|循環器|腎|小児,気管支炎|気管支喘息|心臓衰弱|腎臓病,比較的体力低下,冷え性で貧血傾向、喘鳴、咳嗽、喀痰、水様性鼻汁などを伴う場合
